<?xml version="1.0" encoding="UTF-8" standalone="no" ?>

<!-- XSLT : transofrm in web page with HTML/CSS-->
<?xml-stylesheet type="text/xsl" href= "RepertoireStylesheet.xsl" ?>

<!-- CSS : styliser l'affichage du document XML dans un navigateur web.-->
<?xml-stylesheet href="Repertoire.css" type="text/css" ?>

<!-- DTD : validation -->
<!-- <!DOCTYPE repertoire SYSTEM "repertoire.dtd"> -->


<!-- CORPS with XMLSchemas validation-->

<repertoire xmlns:xsi="http://www.w3.org/2001/XMLSchema-instance"
        xsi:noNamespaceSchemaLocation="repertoireXMLSchema.xsd">

	<!-- John DOE -->
	<personne sexe="masculin">
		<nom>DOE</nom>
		<prenom>John</prenom>
		<adresse>
			<numero>7</numero>
			<voie type="impasse">impasse du chemin</voie>
			<codePostal>75015</codePostal>
			<ville>PARIS</ville>
			<pays>FRANCE</pays>
		</adresse>
		<telephones>
			<telephone type="fixe">01 02 03 04 05</telephone>
			<telephone type="portable">06 07 08 09 10</telephone>
		</telephones>
		<emails>
			<email type="personnel">john.doe@wanadoo.fr</email>
			<email type="professionnel">john.doe@societe.com</email>
		</emails>
	</personne>

	<!-- Marie POPPINS -->
	<personne sexe="feminin">
		<nom>POPPINS</nom>
		<prenom>Marie</prenom>
		<adresse>
			<numero>28</numero>
			<voie type="avenue">avenue de la république</voie>
			<codePostal>13005</codePostal>
			<ville>MARSEILLE</ville>
			<pays>FRANCE</pays>
		</adresse>
		<telephones>
			<telephone type="professionnel">04 05 06 07 08</telephone>
		</telephones>
		<emails>
			<email type="professionnel">contact@poppins.fr</email>
		</emails>
	</personne>

	<!-- Batte MAN -->
	<personne sexe="masculin">
		<nom>MAN</nom>
		<prenom>Batte</prenom>
		<adresse>
			<numero>24</numero>
			<voie type="avenue">impasse des héros</voie>
			<codePostal>11004</codePostal>
			<ville>GOTHAM CITY</ville>
			<pays>USA</pays>
		</adresse>
		<telephones>
			<telephone type="professionnel">01 03 05 07 09</telephone>
		</telephones>
	</personne>

</repertoire>